index,DISTRICT_NAME,BLOCK_NAME,SANCTION_YEAR,IMS_PACKAGE_ID,IMS_ROAD_NAME,IMS_PAV_LENGTH,NQM_INSP_COUNT,NQM_GRADE,SQM_INSP_COUNT1,SQM_GRADE,DISCREPANCY,GRADE_DIFFER,INS_DIFFER,DISCREPANCY_LEVEL,DISCREPANCY_S
207,Aurangabad,Kutumba,2018-2019,BR02R-764,L106-L042 SIMRA TO LEBURA,1.66,0,3,1,0,0,3,1,0.0,0.0
208,Aurangabad,Kutumba,2018-2019,BR02R-765,L068-CHANKAP ROAD TO SIMRI,1.2,0,3,1,2,0,1,1,0.0,0.0
209,Aurangabad,Kutumba,2020-2021,BR02R-828,simratejpara - anjania,0.0,0,3,2,1,0,2,2,0.0,0.0
210,Aurangabad,Kutumba,2021-2022,BR02RC301,O-NH-139 Jharkhand Border Maharajganj Se Baluganj - Bedhani - Deo- Ora - Sokya - Baghoi Railway Station -  Deohara - Baghoigala - Deokund - Basatar - Keyal Hote huye Mehendiya NH-98 Tak.Km 0.00 to 19.30,19.02,0,3,7,1,0,2,7,0.0,0.0
212,Aurangabad,Madanpur,2011-2012,BR-02R-172, Shivganj Rafiganj Road -  Teldiha,4.44,0,3,1,1,0,2,1,0.0,0.0
213,Aurangabad,Madanpur,2016-2017,BR02R622,L057-L069 TO MIRZAPUR (TRACK57) ,1.05,0,3,1,1,0,2,1,0.0,0.0
214,Aurangabad,Madanpur,2018-2019,BR02R-770,L138-L105 to Kushumha,1.15,0,3,1,1,0,2,1,0.0,0.0
215,Aurangabad,Madanpur,2018-2019,BR02R-771,L148-L148-L023 to Bardih,0.875,0,3,1,1,0,2,1,0.0,0.0
216,Aurangabad,Madanpur,2018-2019,BR02R-774,L160-NH2 G.T. Road to Moti Bigha,1.0,0,3,1,1,0,2,1,0.0,0.0
217,Aurangabad,Madanpur,2018-2019,BR02RC007,"Beri Kalali to Bhadwa vai Pirthu, Bishambharpur, karwa, Kharaukhar, Gothani Road",21.865,0,3,1,1,0,2,1,0.0,0.0
219,Aurangabad,Madanpur,2020-2021,BR02R-829,L122-L034 To jamuain (TRACK122),0.0,0,3,2,1,0,2,2,0.0,0.0
221,Aurangabad,Madanpur,2022-2023,BR02RC316,O-Jurahi Nahar To Bhandari.,18.05,0,3,5,1,0,2,5,0.0,0.0
222,Aurangabad,Madanpur,2022-2023,BR02RC317,O-Dhakpahari To Sagarpur.,4.0,0,3,4,1,0,2,4,0.0,0.0
223,Aurangabad,Madanpur,2022-2023,BR02RC319,O-Wakilganj To Chilmi Road Via Bhagwanpur Pitambara Laltaingan,4.3,0,3,3,1,0,2,3,0.0,0.0
224,Aurangabad,Nabinagar,2013-2014,BR2R537,L124-L036 SATAR PMGSY ROAD TO PURAINI (TRACK124),5.995,0,3,1,0,0,3,1,0.0,0.0
225,Aurangabad,Nabinagar,2016-2017,BR02R626,L072-L071 TO KAMARI (TRACK72) ,2.93,0,3,1,1,0,2,1,0.0,0.0
226,Aurangabad,Nabinagar,2017-2018,BR02R687,L120-L034 SALIAA PMGSY ROAD TO BAIRWA LOKNATH (TRACK120) ,1.8,0,3,1,1,0,2,1,0.0,0.0
227,Aurangabad,Nabinagar,2017-2018,BR02R723,L193-L193-T04 Barun Nabinagar road to Darua via Gamhariay,3.0,0,3,1,1,0,2,1,0.0,0.0
228,Aurangabad,Nabinagar,2017-2018,BR02RC004,O-Chatra More NH-98 to Hariharganj via Mali- Navinagar-  Tandwa- Ramnagar Road,49.12,0,3,3,1,0,2,3,0.0,0.0
229,Aurangabad,Nabinagar,2018-2019,BR02R-778,L218-L218-T02 RAMNAGAR TO SIMRA,0.85,0,3,1,1,0,2,1,0.0,0.0
230,Aurangabad,Nabinagar,2018-2019,BR02R-780,L207-T01 to Jharaha,2.2,0,3,1,1,0,2,1,0.0,0.0
231,Aurangabad,Nabinagar,2018-2019,BR02R-784,L160-L063 Bishunpur Gajnadham road to Nonia Bigha,0.8,0,3,1,1,0,2,1,0.0,0.0
232,Aurangabad,Nabinagar,2018-2019,BR02R-789,L164-L078 Ankorha jasoia to Ankorhi,3.35,0,3,1,1,0,2,1,0.0,0.0
233,Aurangabad,Nabinagar,2018-2019,BR02R-790,L179-L179-L044 Dhanawan road to Chandkhap,2.5,0,3,1,1,0,2,1,0.0,0.0
234,Aurangabad,Nabinagar,2018-2019,BR02R-793,L184-L184-T04 BARUN NABINAGAR TO JHARI DHANW,2.5,0,3,1,1,0,2,1,0.0,0.0
235,Aurangabad,Nabinagar,2018-2019,BR02R-794,L180-T03 Nabinagar khjuri tikka road to Phulwariya ,0.75,0,3,1,1,0,2,1,0.0,0.0
236,Aurangabad,Nabinagar,2018-2019,BR02R-795,L183-T04 Nabinagar Barun road to Sinduria,0.7,0,3,2,0,0,3,2,0.0,0.0
237,Aurangabad,Nabinagar,2018-2019,BR02R-796,L182-L055 Beni Ganghar road to Ramsagar Bigha,0.9,0,3,1,1,0,2,1,0.0,0.0
238,Aurangabad,Nabinagar,2018-2019,BR02R-799,L195-L063 Bishunpur Gajnadham road to Ganauri Bigha,0.8,0,3,1,1,0,2,1,0.0,0.0
239,Aurangabad,Nabinagar,2018-2019,BR02R-801,L174-L174-T01 Malee Nabinagar road to Dhibar,2.0,0,3,1,1,0,2,1,0.0,0.0
240,Aurangabad,Nabinagar,2018-2019,BR02R-802,L196-L091 Karam lahang road to lala bigha (Lakhanwa),1.5,0,3,1,1,0,2,1,0.0,0.0
241,Aurangabad,Nabinagar,2018-2019,BR02R-803,L201-L201-L054 kala pahar road to Nita jodh ( Niman jodh),1.0,0,3,1,1,0,2,1,0.0,0.0
242,Aurangabad,Nabinagar,2018-2019,BR02R-825,ITWAN - SIMARI DHAMNI,0.0,0,3,1,1,0,2,1,0.0,0.0
243,Aurangabad,Nabinagar,2018-2019,BR02RC004,O-Chatra More NH-98 to Hariharganj via Mali- Navinagar-  Tandwa- Ramnagar Road,0.0,0,3,2,1,0,2,2,0.0,0.0
244,Aurangabad,Nabinagar,2019-2020,BR02P2R-03,ML02-L027 TO CHARAN KALAN,10.9,0,3,1,1,0,2,1,0.0,0.0
245,Aurangabad,Nabinagar,2020-2021,BR02P3R08,"T14-GHUJJA TO MOKHTARPUR VIA SONAURA, MANJHULI REGHANIA,SIMRA JAIPUR",13.35,0,3,2,1,0,2,2,0.0,0.0
248,Aurangabad,Nabinagar,2020-2021,BR02R-831,L057-L058 TO EKDARA (TRACK57) ,0.0,0,3,2,1,0,2,2,0.0,0.0
249,Aurangabad,Nabinagar,2020-2021,BR02R-832,L124-L036 SATAR PMGSY ROAD TO PURAINI (TRACK124),0.0,0,3,2,1,0,2,2,0.0,0.0
251,Aurangabad,Nabinagar,2020-2021,BR02R-834,L117-L060 CHANDRAGARH GAJNADHAM ROAD TO PIPARDIH (TRACK117) ,0.0,0,3,2,1,0,2,2,0.0,0.0
252,Aurangabad,Nabinagar,2020-2021,BR02R-835,L117-L060 CHANDRAGARH GAJNADHAM ROAD TO PIPARDIH (TRACK117),0.0,0,3,2,1,0,2,2,0.0,0.0
253,Aurangabad,Obra,2008-2009,BR-02R-109,Tara - Araikhap,2.753,0,3,1,1,0,2,1,0.0,0.0
254,Aurangabad,Obra,2016-2017,BR02R635,L095-BEL PAUTHU TO MANIKPUR (TRACK68) ,0.65,0,3,1,0,0,3,1,0.0,0.0
255,Aurangabad,Obra,2018-2019,BR02R-804,L106-L069 TO DUMRI,0.678,0,3,1,0,0,3,1,0.0,0.0
256,Aurangabad,Obra,2018-2019,BR02R-805,L109-L065 TO HASANPURA,2.813,0,3,2,0,0,3,2,0.0,0.0
257,Aurangabad,Obra,2018-2019,BR02R-807,L105-L057 TO BIGHAPAR,2.48,0,3,1,0,0,3,1,0.0,0.0
258,Aurangabad,Obra,2018-2019,BR02R-808,L108-L084 TO HARIJAN TOLA,1.03,0,3,2,0,0,3,2,0.0,0.0
259,Aurangabad,Obra,2018-2019,BR02RC009,Dihara to Obra Road,13.71,0,3,1,1,0,2,1,0.0,0.0
260,Aurangabad,Obra,2018-2019,BR02RC010,Obra - Bel - Barhi Road.,14.69,0,3,1,1,0,2,1,0.0,0.0
262,Aurangabad,Obra,2020-2021,BR02P3R11,MRL07-AURANGABAD PATNA ROAD TO MAKHRA VIA MAHUANIAN KHARATI MAHUAWAN,7.7,0,3,2,1,0,2,2,0.0,0.0
265,Aurangabad,Rafiganj,2011-2012,BR-02R-218, Kasma Road -  Chiraila,6.774,0,3,2,1,0,2,2,0.0,0.0
266,Aurangabad,Rafiganj,2013-2014,BR02R389,L046-L045 TO MAJHKAR (VR27),2.25,0,3,1,0,0,3,1,0.0,0.0
267,Aurangabad,Rafiganj,2013-2014,BR02R391,L064-L108 TO CHANRAHI (VR64),2.3,0,3,1,0,0,3,1,0.0,0.0
268,Aurangabad,Rafiganj,2013-2014,BR02R399,L098-T03 TO PANTI (VR98),3.1,0,3,1,1,0,2,1,0.0,0.0
269,Aurangabad,Rafiganj,2016-2017,BR02R646,"L147-TO5, MOHANPUR (TRACK147) ",1.209,0,3,1,0,0,3,1,0.0,0.0
270,Aurangabad,Rafiganj,2016-2017,BR02R647,L153-LATA TO DALBIGHA (TRACK153) ,1.161,0,3,1,1,0,2,1,0.0,0.0
271,Aurangabad,Rafiganj,2016-2017,BR02R648,L154-MAKHDUMPUR NAHAR TO NAYKI (VR154) ,3.0,0,3,1,0,0,3,1,0.0,0.0
272,Aurangabad,Rafiganj,2016-2017,BR02R650,L168-BARKI ENGLISH FESHARA KUSHIM TO ISHAK BIGHA (TRACK168) ,2.825,0,3,1,1,0,2,1,0.0,0.0
273,Aurangabad,Rafiganj,2017-2018,BR02RC002,"O-Gaya to Koiwa More via Paraiya Guraru Rafiganj Poauthu Road (Part-A, in Aurangabad District)",42.187,0,3,3,1,0,2,3,0.0,0.0
274,Aurangabad,Rafiganj,2017-2018,BR02RC003,O-Pipraura More to Diehri More via Baligawan - Bhadwa- Kajpa-Danai-Gandharap-Indrar Achuki Road,39.97,0,3,3,1,0,2,3,0.0,0.0
275,Aurangabad,Rafiganj,2017-2018,BR02RC005,O-Rafiganj -Kasma- Gurua- Naudiha- Duba Road (Part-A in Aurangabad District),16.2,0,3,1,1,0,2,1,0.0,0.0
276,Aurangabad,Rafiganj,2018-2019,BR02R-810,L192-L029 to BANKE BIGHA,1.883,0,3,1,1,0,2,1,0.0,0.0
277,Aurangabad,Rafiganj,2018-2019,BR02R-811,L193-T07 to SALEMPUR,1.145,0,3,1,1,0,2,1,0.0,0.0
278,Aurangabad,Rafiganj,2018-2019,BR02R-812,L175-T04 to SANTOSHI BIGHA,1.65,0,3,1,0,0,3,1,0.0,0.0
279,Aurangabad,Rafiganj,2018-2019,BR02R-813,L189-L080 to BHUYIA TOLA,0.95,0,3,1,1,0,2,1,0.0,0.0
280,Aurangabad,Rafiganj,2018-2019,BR02R-814,L191-L037 to VISHRAMPUR,0.807,0,3,1,1,0,2,1,0.0,0.0
281,Aurangabad,Rafiganj,2018-2019,BR02R-816,L196-T01 to SIMRAHUA,2.195,0,3,1,0,0,3,1,0.0,0.0
282,Aurangabad,Rafiganj,2018-2019,BR02R-817,L197-L137 to DUARI,0.77,0,3,1,1,0,2,1,0.0,0.0
283,Aurangabad,Rafiganj,2018-2019,BR02RC003,O-Pipraura More to Diehri More via Baligawan - Bhadwa- Kajpa-Danai-Gandharap-Indrar Achuki Road,0.0,0,3,1,1,0,2,1,0.0,0.0
286,Banka,Amarpur,2013-2014,BR03R237,L058-Amarpur Sahkund to Biswaspur (VR38),0.72,0,3,2,1,0,2,2,0.0,0.0
287,Banka,Amarpur,2013-2014,BR03R240,L056-Belsira Pansalla to Pathaki (VR37),1.431,0,3,1,0,0,3,1,0.0,0.0
288,Banka,Amarpur,2013-2014,BR03R354,L076-Amarpur Chokar Road to Maldeochak (VR54),1.507,0,3,1,1,0,2,1,0.0,0.0
289,Banka,Amarpur,2016-2017,BR03R395,L077-Bishanpur Kothia to Nanaychak Mainathchak (VR55) ,4.0,0,3,1,1,0,2,1,0.0,0.0
290,Banka,Amarpur,2016-2017,BR03R396,L079-Ranikitta to Kajra via Athmaha (VR57) ,4.85,0,3,1,0,0,3,1,0.0,0.0
291,Banka,Amarpur,2016-2017,BR03R397,L074-Banka Amarpur Road Bhimsen to Ratanpur (VR52),3.03,0,3,1,1,0,2,1,0.0,0.0
292,Banka,Amarpur,2016-2017,BR03R398,L078-Banka Amarpur Road Fatehpur to Nurganj (VR56),0.68,0,3,1,1,0,2,1,0.0,0.0
293,Banka,Amarpur,2017-2018,BR03RC025,O-Amarpur - Shambhuganj Road,24.0,0,3,3,1,0,2,3,0.0,0.0
294,Banka,Amarpur,2017-2018,BR03RC027,O-Chaturvedi Ashram Road,12.7,0,3,3,1,0,2,3,0.0,0.0
295,Banka,Amarpur,2018-2019,BR03RC025A,O-Amarpur - Shambhuganj Road,0.0,0,3,3,1,0,2,3,0.0,0.0
296,Banka,Amarpur,2018-2019,BR03RC025B,O-Amarpur - Shambhuganj Road,0.0,0,3,2,1,0,2,2,0.0,0.0
297,Banka,Amarpur,2018-2019,BR03RC025C,O-Amarpur - Shambhuganj Road,0.0,0,3,3,2,0,1,3,0.0,0.0
298,Banka,Amarpur,2018-2019,BR03RC025D,O-Amarpur - Shambhuganj Road,0.0,0,3,2,1,0,2,2,0.0,0.0
299,Banka,Amarpur,2018-2019,BR03RC029,English More to Punsia Road via Jethornath,11.712,0,3,2,1,0,2,2,0.0,0.0
300,Banka,Amarpur,2018-2019,BR3RC029A,English More to Punsia Road via Jethornath,0.0,0,3,1,1,0,2,1,0.0,0.0
301,Banka,Amarpur,2018-2019,BR3RC029B,English More to Punsia Road via Jethornath,0.0,0,3,2,1,0,2,2,0.0,0.0
303,Banka,Amarpur,2020-2021,BR03R-502,L081-Mahadeopur Kaswa Road to Laungain via Chandpur (VR59) ,0.0,0,3,2,1,0,2,2,0.0,0.0
305,Banka,Amarpur,2022-2023,BR03P3R03,T10-Bhagalpur Amarpur(SH25)(Nandlalpatti) to Laxmipur Via Ramchandarpur,6.925,0,3,3,1,0,2,3,0.0,0.0
307,Banka,Amarpur,2022-2023,BR03P3R05,"MRL02-Amarpur Bhagalpur PWD to Baijudih(Sultanpur) to Rajapur Via Baijudih,Kulhariya Verma",7.335,0,3,2,0,0,3,2,0.0,0.0
308,Banka,Banka,2013-2014,BR03R248,L041-BANKA - VIA-JAMDAHA TO DEOGHAR TO2 TO DESARIA (VR22),1.476,0,3,1,1,0,2,1,0.0,0.0
309,Banka,Banka,2013-2014,BR03R249,L078-KATALI L053 TO BHUKHIYA (VR54),1.501,0,3,1,1,0,2,1,0.0,0.0
310,Banka,Banka,2013-2014,BR03R250,L071-BALIMARA L066 TO KATAHARA (VR47),1.585,0,3,2,1,0,2,2,0.0,0.0
311,Banka,Banka,2016-2017,BR03R400,L081-KATELI MORE DUNA L066 TO  GADHWA TAREE (VR57) ,2.428,0,3,1,1,0,2,1,0.0,0.0
312,Banka,Banka,2016-2017,BR03R401,L080-KATELI  MORE DONA LO66 TO DOSHADHI (VR56) ,1.172,0,3,1,1,0,2,1,0.0,0.0
313,Banka,Banka,2017-2018,BR03R473,L082-BANKA - POKHRIYA T05 TO KAMALDIH (VR58) ,0.7,0,3,1,1,0,2,1,0.0,0.0
314,Banka,Banka,2017-2018,BR03RC022,O-BANKA - BELHAR (OLD) ROAD,7.7,0,3,2,1,0,2,2,0.0,0.0
315,Banka,Banka,2018-2019,BR03R-483,L080-KATELI  MORE DONA LO66 TO DOSHADHI (VR56) ,0.0,0,3,1,1,0,2,1,0.0,0.0
316,Banka,Banka,2018-2019,BR03R-484,L030-BANKA -DHAKA MORE SHANKARPUR TO DEVPUR JALMARAI (VR14) ,0.0,0,3,1,1,0,2,1,0.0,0.0
317,Banka,Banka,2018-2019,BR03R-485,L051-BANKA-POKHARIA T04 NEAR DUDHARI VILL-TO CHHATARPAL (VR29) ,0.0,0,3,2,0,0,3,2,0.0,0.0
318,Banka,Banka,2018-2019,BR03R-486,L051-BANKA-POKHARIA T04 NEAR DUDHARI VILL-TO CHHATARPAL (VR29) ,0.0,0,3,1,1,0,2,1,0.0,0.0
320,Banka,Banka,2018-2019,BR03RC022B,Banka-Belhar(old) Road,0.0,0,3,2,1,0,2,2,0.0,0.0
321,Banka,Banka,2020-2021,BR03R-503,"L052-BANKA - POKHARIYA T04 DUDHARI CHHATARPAL L051 TO GANGATI-BHOUNRA,, (VR30) ",0.0,0,3,2,1,0,2,2,0.0,0.0
324,Banka,Barahat,2016-2017,BR03R415,L058-Bikrampur RD to  Gobindpur (TRACK58) ,0.0,0,3,1,0,0,3,1,0.0,0.0
325,Banka,Barahat,2018-2019,BR03R-487,L031-Panjwara Dhoraiya to Duwarajpur (TRACK31) ,0.0,0,3,1,1,0,2,1,0.0,0.0
327,Banka,Barahat,2022-2023,BR03P3R17,T03-BGP Dumka rd (Kharhara) TO Vijayhat,5.57,0,3,3,1,0,2,3,0.0,0.0
329,Banka,Baunsi,2008-2009,BR-03R-028,SHYAM BAZAR( KUSBADIA ) - SANGA,1.371,0,3,2,0,0,3,2,0.0,0.0
330,Banka,Baunsi,2016-2017,BR03R405,L024-L022 TO DARGATHI AMARBARAIT (TRACK24) ,0.0,0,3,1,1,0,2,1,0.0,0.0
331,Banka,Baunsi,2016-2017,BR03R406,L024-L022 TO DARGATHI AMARBARAIT (TRACK24) ,0.0,0,3,2,1,0,2,2,0.0,0.0
332,Banka,Baunsi,2016-2017,BR03R407,L055-BAUSI IRRIAGION DAM RD (TRACK55) ,0.0,0,3,1,1,0,2,1,0.0,0.0
333,Banka,Baunsi,2016-2017,BR03R409,L035-BGP-DUMKA RD TO RAUTABARAN (TRACK35) ,0.0,0,3,1,1,0,2,1,0.0,0.0
334,Banka,Baunsi,2016-2017,BR03R410,L049-BGP-DUMKA RD KAIRI (TRACK49) ,0.0,0,3,1,1,0,2,1,0.0,0.0
335,Banka,Baunsi,2016-2017,BR03R416,L104-RAMPUR PABRA VIA RANGA TO SARONCHA (TRACK104) ,3.4,0,3,1,0,0,3,1,0.0,0.0
336,Banka,Baunsi,2016-2017,BR03R418,L105-RAJDAH TO BELTIKARI (TRACK105) ,2.0,0,3,1,1,0,2,1,0.0,0.0
337,Banka,Baunsi,2016-2017,BR03R423,L102-BGP-DUMKA RD TO BEGDUMA (TRACK102) ,1.05,0,3,1,1,0,2,1,0.0,0.0
338,Banka,Baunsi,2016-2017,BR03R424,L114-khangarh PRIMARY SCHOOL TO Sahasaram (TRACK114) ,2.4,0,3,1,1,0,2,1,0.0,0.0
339,Banka,Baunsi,2016-2017,BR03R425,L024-L022 TO DARGATHI AMARBARAIT (TRACK24) ,4.7,0,3,1,1,0,2,1,0.0,0.0
340,Banka,Baunsi,2016-2017,BR03R468,L061-L064 TO LOBANDO (TRACK61) ,1.4,0,3,1,1,0,2,1,0.0,0.0
341,Banka,Baunsi,2018-2019,BR03R-488,L029-BGP-DUMKA RD TO SIKANDARPUR (TRACK29) ,0.0,0,3,1,1,0,2,1,0.0,0.0
342,Banka,Baunsi,2018-2019,BR03R-489,L114-khangarh PRIMARY SCHOOL TO Sahasaram (TRACK114) ,0.0,0,3,1,1,0,2,1,0.0,0.0
343,Banka,Baunsi,2018-2019,BR03R-490,L063-BHALJOR PWD RD VIA DUMARIYA MISSION SANPDAHAR TO DAM RD (TRACK63) ,0.0,0,3,1,1,0,2,1,0.0,0.0
345,Banka,Belhar,2008-2009,BR-03R-181,KUMRI-CHIRAYA ROAD - KURPATARI,2.986,0,3,2,0,0,3,2,0.0,0.0
346,Banka,Belhar,2013-2014,BR03R274,L087-Belhar Jhunhka T04 To Giddha (VR87),0.808,0,3,1,0,0,3,1,0.0,0.0
347,Banka,Belhar,2013-2014,BR03R277,L085-Belhar sandipi sautadih to Boka (TRACK85),1.803,0,3,1,0,0,3,1,0.0,0.0
348,Banka,Belhar,2013-2014,BR03R371,L050-Belhar Deoghar Road To Saabaijor (VR50),6.13,1,1,0,3,0,2,1,0.0,0.0
349,Banka,Belhar,2013-2014,BR03R373,L073-Shrinagar to chandan nagar (TRACK73),2.165,0,3,1,0,0,3,1,0.0,0.0
350,Banka,Belhar,2018-2019,BR03R-491,L068-Kumari Gerwa Dhaniyari Road To Kurpatri (VR68) ,0.0,0,3,1,1,0,2,1,0.0,0.0
351,Banka,Belhar,2018-2019,BR03R-492,L068-Kumari Gerwa Dhaniyari Road To Kurpatri (VR68) ,0.0,0,3,2,2,0,1,2,0.0,0.0
354,Banka,Belhar,2022-2023,BR03P3R09,T02-BANKA BELHAR RCD ROAD TO FULLIDUMAR KHESAR BAZAR VIA SATIGHAT,7.37,0,3,2,1,0,2,2,0.0,0.0
355,Banka,Belhar,2022-2023,BR03P3R10,"MRL03-SH-22 BELHAR BAZAR TO SANDIPI (JAMUI RCD) VIA GAWA ,CHAK,GHOGHA,KHASIA",13.07,0,3,3,1,0,2,3,0.0,0.0
356,Banka,Chanan,2013-2014,BR03R08,LAUKARIA KATORIYA SIMULTALLA PWD ROAD - AAHRA,0.0,0,3,1,1,0,2,1,0.0,0.0
357,Banka,Chanan,2013-2014,BR03R279,L066 - Tingarwa to Baradih (TRACK66),1.26,1,0,0,3,0,3,1,0.0,0.0
358,Banka,Chanan,2016-2017,BR03R429,L054-Chandan Deoghar-PWD Rd .Via-Garbhudih to Dumarkala (TRACK54) ,6.5,0,3,1,1,0,2,1,0.0,0.0
359,Banka,Chanan,2016-2017,BR03R432,L056-Nawadih Road to Nari Jamdaha (TRACK56) ,0.0,0,3,1,1,0,2,1,0.0,0.0
360,Banka,Chanan,2016-2017,BR03R433,L064-Gauripur to Jogmoran (TRACK64) ,0.0,0,3,1,1,0,2,1,0.0,0.0
361,Banka,Chanan,2016-2017,BR03R435,L071-Katoria Simutalla Pwd to Jahangira (TRACK71) ,0.0,0,3,1,1,0,2,1,0.0,0.0
362,Banka,Chanan,2016-2017,BR03R436,L083-Kolhaydih -Jhagra RD To Kanaudih (TRACK83) ,0.0,0,3,1,1,0,2,1,0.0,0.0
363,Banka,Chanan,2017-2018,BR03R474,L024-Belhar Katoria Pwd Road to Aamtuwa (TRACK24) ,4.401,0,3,1,0,0,3,1,0.0,0.0
364,Banka,Chanan,2017-2018,BR03R475,L032-Belhar Katoria Pwd Road to Alkasia (TRACK32) ,2.014,0,3,1,1,0,2,1,0.0,0.0
365,Banka,Chanan,2017-2018,BR03R476,L051-Chandan Deoghar .PWD to Pahridih (TRACK51) ,1.71,0,3,1,1,0,2,1,0.0,0.0
366,Banka,Chanan,2017-2018,BR03R477,L045-Katoriya  pwd  road  to  Parsiya (TRACK45) ,2.992,0,3,2,1,0,2,2,0.0,0.0
367,Banka,Chanan,2017-2018,BR03R478,L092-Sueya Bhelwa Road to Berfera (TRACK92) ,1.71,0,3,1,0,0,3,1,0.0,0.0
368,Banka,Chanan,2017-2018,BR03R479,L095-Tarakura More To Tarakura (TRACK95) ,3.314,0,3,1,1,0,2,1,0.0,0.0
369,Banka,Chanan,2017-2018,BR03R480,L043-Garkar  Road  to  Harkhar (TRACK43) ,1.7,0,3,2,1,0,2,2,0.0,0.0
370,Banka,Chanan,2017-2018,BR03RC024,PANDEDIH-LAHAWAN ROAD (Part of Banka District),7.0,0,3,3,1,0,2,3,0.0,0.0
371,Banka,Chanan,2018-2019,BR03R-493,KATORIYA PWD ROAD - CHIHUTGORE,0.0,0,3,1,1,0,2,1,0.0,0.0
372,Banka,Chanan,2018-2019,BR03R-494,L034-Belhar Katoria Pwd Road to Hardiya Kala (TRACK34) ,0.0,0,3,1,1,0,2,1,0.0,0.0
373,Banka,Chanan,2018-2019,BR03RC024A,Pandedih- Lahawan Road (Part of Banka District),0.0,0,3,2,1,0,2,2,0.0,0.0
374,Banka,Chanan,2019-2020,BR03P2R-04,MRL01-Jamui Bordar to Kendua Via Goriamba Piparadih Narayanpur,10.05,0,3,2,1,0,2,2,0.0,0.0
375,Banka,Dhoraiya,2008-2009,BR-03R-047,RAJAWAR-NAWADA - BIRNIA,2.717,0,3,1,0,0,3,1,0.0,0.0
376,Banka,Dhoraiya,2016-2017,BR03R411,L064-Dhoraiya Nawada Rd. to Kathra (VR64) ,0.0,0,3,1,0,0,3,1,0.0,0.0
377,Banka,Dhoraiya,2016-2017,BR03R412,L037-Sanhaula Panjwara Rd. to Singhpur Babhangama (VR37) ,0.0,0,3,1,0,0,3,1,0.0,0.0
378,Banka,Dhoraiya,2016-2017,BR03R413,L064-Dhoraiya Nawada Rd. to Kathra (VR64) ,0.0,0,3,1,0,0,3,1,0.0,0.0
379,Banka,Dhoraiya,2016-2017,BR03R437,"L107-T01 Bindi Chitka To Dharhara , Dumarjor (VR107) ",3.906,0,3,1,1,0,2,1,0.0,0.0
380,Banka,Dhoraiya,2016-2017,BR03R440,L106-Rangaon To Gadian (VR106) ,0.906,0,3,1,0,0,3,1,0.0,0.0
381,Banka,Dhoraiya,2018-2019,BR03R-495,L106-Rangaon To Gadian (VR106) ,0.0,0,3,2,1,0,2,2,0.0,0.0
382,Banka,Dhoraiya,2018-2019,BR03R-496,"L107-T01 Bindi Chitka To Dharhara , Dumarjor (VR107) ",0.0,0,3,1,1,0,2,1,0.0,0.0
383,Banka,Dhoraiya,2022-2023,BR03P3R19,T13-Mahila more (Mahgama Dhoraiya RCD Road) to Nanan more,7.25,0,3,2,1,0,2,2,0.0,0.0
384,Banka,Dhoraiya,2022-2023,BR03P3R20,T05-SH 84 Sadpur more( Dhoraiya Panjwara RCD Road)To Pajwara bazar pul ke nikat,11.2,0,3,2,1,0,2,2,0.0,0.0
385,Banka,Fulli Dumar,2007-2008,BR0349,Samukhia-Ramsaraiya (Gora) - Olhani,5.92,1,0,0,3,0,3,1,0.0,0.0
386,Banka,Fulli Dumar,2016-2017,BR03R394,L047-Salaiya - Bharkutia to Chaudaran (VR16) ,3.7,0,3,2,1,0,2,2,0.0,0.0
388,Banka,Fulli Dumar,2017-2018,BR03RC023,O-RAMPUR-DALAWA-RAMSARAIYA ROAD,18.25,0,3,2,1,0,2,2,0.0,0.0
389,Banka,Fulli Dumar,2018-2019,BR03RC021A,Banka- Belhar Road,0.0,0,3,2,1,0,2,2,0.0,0.0
390,Banka,Fulli Dumar,2018-2019,BR03RC021B,Banka- Belhar Road,0.0,0,3,2,1,0,2,2,0.0,0.0
391,Banka,Fulli Dumar,2018-2019,BR03RC023A,O-RAMPUR-DALAWA-RAMSARAIYA ROAD,0.0,0,3,2,1,0,2,2,0.0,0.0
392,Banka,Fulli Dumar,2018-2019,BR03RC023B,O-RAMPUR-DALAWA-RAMSARAIYA ROAD,0.0,0,3,2,1,0,2,2,0.0,0.0
393,Banka,Fulli Dumar,2020-2021,BR03R-504,L050-Salaiya to Garijor (VR17) ,0.0,0,3,2,1,0,2,2,0.0,0.0
394,Banka,Fulli Dumar,2020-2021,BR03R-505,L065-Shamukhiya more to Dhanwan (TRACK65) ,0.0,0,3,2,1,0,2,2,0.0,0.0
395,Banka,Fulli Dumar,2020-2021,BR03R-506,L055-Samukhia-Rampur to Kathdarn (VR21) ,0.0,0,3,2,1,0,2,2,0.0,0.0
397,Banka,Katoria,2016-2017,BR03R441,L083-Kajhar To Kachnath (VR83) ,6.63,0,3,1,0,0,3,1,0.0,0.0
398,Banka,Katoria,2016-2017,BR03R443,L090-T05 Karda To Bhalua (VR90) ,2.0,0,3,2,1,0,2,2,0.0,0.0
399,Banka,Katoria,2016-2017,BR03R444,L081-Kulharia To Katahara (VR81) ,4.0,0,3,1,0,0,3,1,0.0,0.0
400,Banka,Katoria,2016-2017,BR03R446,L104-Katoriya Simultala To Harijan Tola (VR104) ,1.56,0,3,1,1,0,2,1,0.0,0.0
401,Banka,Katoria,2016-2017,BR03R450,L037-T02 Majhliyadih To Kalothar (VR37) ,1.9,0,3,1,1,0,2,1,0.0,0.0
402,Banka,Katoria,2016-2017,BR03R452,L105-Darda to Chananthara (VR105) ,3.63,0,3,1,1,0,2,1,0.0,0.0
403,Banka,Katoria,2016-2017,BR03R453,L023-Katoria Simultala Rd. to Dewasi (VR23) ,4.11,0,3,1,0,0,3,1,0.0,0.0
404,Banka,Katoria,2016-2017,BR03R455,L062-T03  Charkhapathar To Makanda (VR62) ,3.868,0,3,1,1,0,2,1,0.0,0.0
405,Banka,Katoria,2016-2017,BR03R457,T03-Banka Dumka To Jaipur (VR3) ,0.0,0,3,1,1,0,2,1,0.0,0.0
406,Banka,Katoria,2016-2017,BR03R458,T03-Banka Dumka To Jaipur (VR3) ,0.0,0,3,2,1,0,2,2,0.0,0.0
407,Banka,Katoria,2016-2017,BR03R459,T03-Banka Dumka To Jaipur (VR3) ,0.0,0,3,2,1,0,2,2,0.0,0.0
408,Banka,Katoria,2016-2017,BR03R460,L058-Jaipur Jamda To Bathnawaran (VR58) ,0.0,0,3,1,1,0,2,1,0.0,0.0
409,Banka,Katoria,2016-2017,BR03R461,L046-Jamdaha To Basmatta (VR46) ,0.0,0,3,2,1,0,2,2,0.0,0.0
410,Banka,Katoria,2016-2017,BR03R462,L037-T02 Majhliyadih To Kalothar (VR37) ,0.0,0,3,2,1,0,2,2,0.0,0.0
411,Banka,Katoria,2016-2017,BR03R469,L091-T05 Dholadanr To Tiliya (VR91) ,0.9,0,3,1,1,0,2,1,0.0,0.0
412,Banka,Katoria,2016-2017,BR03R470,L040-Katoriya Banka PWd Rd. to Mochnhawaran (VR40) ,2.2,0,3,1,0,0,3,1,0.0,0.0
413,Banka,Katoria,2016-2017,BR03R471,L086-Burhighat To Damodara (VR86) ,3.0,0,3,1,1,0,2,1,0.0,0.0
414,Banka,Katoria,2017-2018,BR03R481,L103-Kasmoh To Tarpatiya (VR103) ,1.891,0,3,1,0,0,3,1,0.0,0.0
415,Banka,Katoria,2017-2018,BR03R482,L072-Motharzar Rd to Uperchak (VR72) ,4.398,0,3,2,0,0,3,2,0.0,0.0
416,Banka,Katoria,2018-2019,BR03R-497,L077-Jamdaha to Maniya (VR77) ,0.0,0,3,2,1,0,2,2,0.0,0.0
417,Banka,Katoria,2018-2019,BR03R-498,L096-Radhanagar Rajsare More To Barbasni (VR96) ,0.0,0,3,1,1,0,2,1,0.0,0.0
418,Banka,Katoria,2018-2019,BR03R-499,L098-Darda To Asnatari (VR98) ,0.0,0,3,1,1,0,2,1,0.0,0.0
419,Banka,Katoria,2019-2020,BR03P2R-05,"T01-Arpathar  to  Bounsi Dam road via Sarua, Malbathan, palania",12.45,0,3,2,1,0,2,2,0.0,0.0
425,Banka,Rajaun,2016-2017,BR03R472,L023-L0 21 TO NUNUWACHAK (TRACK2) ,1.5,0,3,1,1,0,2,1,0.0,0.0
426,Banka,Rajaun,2018-2019,BR03R-500,L042-RAJAWAR TO NAWADA (TRACK14) ,0.0,0,3,1,1,0,2,1,0.0,0.0
427,Banka,Rajaun,2018-2019,BR03R-501,L056-CHAKSAPIA VIA BARAUNI TO PARGHARI (TRACK23) ,0.0,0,3,1,1,0,2,1,0.0,0.0
430,Banka,Rajaun,2022-2023,BR03P3R22,MRL02-Mirzapur High school(BGP Dumka RCD Road ) to Muradpur More ,7.323,0,3,3,1,0,2,3,0.0,0.0
431,Banka,Rajaun,2022-2023,BR03P3R23,T14-MURADPUR MORE (KHAIRA TO LAKRA ROAD) TO ISLAMPUR MORE,8.082,0,3,3,1,0,2,3,0.0,0.0
432,Banka,Shambhuganj,2016-2017,BR03R404,L053-Mirjapur kiranpur road to Mahisautha (TRACK53) ,3.24,0,3,1,0,0,3,1,0.0,0.0
434,Banka,Shambhuganj,2018-2019,BR3RC026A,Shambhuganj to Asarganj Road,0.0,0,3,3,1,0,2,3,0.0,0.0
435,Banka,Shambhuganj,2018-2019,BR3RC026B,Shambhuganj to Asarganj Road,0.0,0,3,3,1,0,2,3,0.0,0.0
436,Banka,Shambhuganj,2020-2021,BR03R-510,L075-Gulni to Narsani (VR37) ,0.0,0,3,2,1,0,2,2,0.0,0.0
437,Banka,Shambhuganj,2022-2023,BR03P3R13,T01-Kharaundha More Dauri Dharmshala Road To Tarapur Jilani Road,13.1,0,3,3,1,0,2,3,0.0,0.0
438,Banka,Shambhuganj,2022-2023,BR03P3R14,T04-KAITHA TO GIDAURA,5.68,0,3,3,1,0,2,3,0.0,0.0
440,Banka,Shambhuganj,2022-2023,BR03P3R16,"T02-Khesar Tarapur JIlani Road to Kharaundhha Basbitta road Via Phokhar,Asauta,Mahavir Chowck Ashauta (Nagel),Basbitta",5.675,0,3,2,1,0,2,2,0.0,0.0
441,Begusarai,Bacchwara ,2008-2009,BR-04R-045,T-04 - CHAMATA KURMITOLA,1.642,0,3,1,1,0,2,1,0.0,0.0
442,Begusarai,Bacchwara ,2008-2009,BR-04R-062,X Road - Chan Barkhut C. Ghat,4.845,0,3,1,0,0,3,1,0.0,0.0
443,Begusarai,Bacchwara ,2017-2018,BR04R239,L039-T01 To Dargahpur (VR39) ,1.23,0,3,2,1,0,2,2,0.0,0.0
444,Begusarai,Bacchwara ,2017-2018,BR04R240,L023 - NH-28 To Temahuan (VR23),0.0,0,3,2,0,0,3,2,0.0,0.0
445,Begusarai,Bacchwara ,2018-2019,BR04R-245,L044-T04 To Chamtha Kurmitola (VR44) ,0.0,0,3,2,1,0,2,2,0.0,0.0
446,Begusarai,Bakhri,2019-2020,BR04P2R-01,MRL01-BAKHRI T02 TO NISHARA (VR4),3.8,0,3,2,1,0,2,2,0.0,0.0
447,Begusarai,Baliya,2013-2014,BR04R185,L030 - TO1 TO MAJHANPUR (VR10),1.551,0,3,1,0,0,3,1,0.0,0.0
449,Begusarai,Baliya,2020-2021,BR04P3R01,MRL02-Manserpur to Hetimpur,6.75,0,3,2,1,0,2,2,0.0,0.0
452,Begusarai,Baliya,2020-2021,BR04P3R04,MRL01-T-02 to Sadipur via Manserpur,6.58,0,3,3,1,0,2,3,0.0,0.0
453,Begusarai,Baliya,2022-2023,BR04P3R08,MRL03-CHECHIYARI BRIZE TO BISUNPUR,0.0,0,3,3,1,0,2,3,0.0,0.0
454,Begusarai,Baliya,2022-2023,BR04P3R09,MRL02-Manserpur to Hetimpur,0.0,0,3,3,1,0,2,3,0.0,0.0
455,Begusarai,Baliya,2022-2023,BR04P3R10,MRL02-Manserpur to Hetimpur,0.0,0,3,2,1,0,2,2,0.0,0.0
456,Begusarai,Baliya,2022-2023,BR04P3R11,MRL01-T-02 to Sadipur via Manserpur,0.0,0,3,2,1,0,2,2,0.0,0.0
457,Begusarai,Baliya,2022-2023,BR04P3R12,MRL01-T-02 to Sadipur via Manserpur,0.0,0,3,2,1,0,2,2,0.0,0.0
458,Begusarai,Baliya,2022-2023,BR04P3R13,MRL01-T-02 to Sadipur via Manserpur,0.0,0,3,3,1,0,2,3,0.0,0.0
459,Begusarai,Baliya,2022-2023,BR04P3R14,MRL01-T-02 to Sadipur via Manserpur,0.0,0,3,3,1,0,2,3,0.0,0.0
460,Begusarai,Barauni,2012-2013,BR-04R-074,T01 NH - SABAURA,4.68,0,3,2,0,0,3,2,0.0,0.0
462,Begusarai,Begusarai,2016-2017,BR04R225,L058-L026 Parna Masjid To Harizen Tola (TRACK20) ,0.591,0,3,1,0,0,3,1,0.0,0.0
463,Begusarai,Begusarai,2017-2018,BR04R241,Rajapur Chandpura REO Rd near Bhukhamari Ya Dhala to Korith,0.0,0,3,2,0,0,3,2,0.0,0.0
464,Begusarai,Begusarai,2017-2018,BR04R242,L-077 - GANDHIGRAM,0.0,0,3,1,0,0,3,1,0.0,0.0
465,Begusarai,Begusarai,2019-2020,BR04P2R-03,MRL01-T01 TO BANBADA (TRACK5),5.49,0,3,2,1,0,2,2,0.0,0.0
466,Begusarai,Begusarai,2019-2020,BR04P2R-04,MRL02-BHAGWANPUR TO NEEMA (ODR2),13.05,0,3,4,0,0,3,4,0.0,0.0
467,Begusarai,Bhagwanpur,2008-2009,BR-04R-038,JAGDISHPUR - BUCHAULI,1.871,0,3,2,1,0,2,2,0.0,0.0
468,Begusarai,Bhagwanpur,2013-2014,BR04R190,L027-L026 to Katharia (VR27),2.153,0,3,1,1,0,2,1,0.0,0.0
469,Begusarai,Bhagwanpur,2013-2014,BR04R191,L030-T02 to Raghunandanpur (VR30),1.356,0,3,1,1,0,2,1,0.0,0.0
470,Begusarai,Bhagwanpur,2016-2017,BR04R232,L039-T02 To Tajpur (VR39) ,0.517,0,3,1,0,0,3,1,0.0,0.0
471,Begusarai,Bhagwanpur,2019-2020,BR04P2R-05,MRL01-BHAGWANPUR TO HADICHAK,0.0,0,3,2,1,0,2,2,0.0,0.0
472,Begusarai,Bhagwanpur,2019-2020,BR04P2R-06,MRL01-BHAGWANPUR TO HADICHAK,5.59,0,3,2,1,0,2,2,0.0,0.0
473,Begusarai,Birpur,2008-2009,BR-04R-014,NEWALA BARAIPUR  - SARONJA ROAD,4.05,0,3,1,0,0,3,1,0.0,0.0
474,Begusarai,Birpur,2017-2018,BR04R243,L022-T01 To Baraipura (TRACK2) ,0.0,0,3,1,0,0,3,1,0.0,0.0
475,Begusarai,Cheriabariarpur ,2016-2017,BR04R229,L043-SAKARBASA SRIPUR ROAD TO BHITIARAHI (VR) ,1.222,0,3,1,1,0,2,1,0.0,0.0
476,Begusarai,Cheriabariarpur ,2016-2017,BR04R230,L045-SHAHPUR PWD ROAD TO BEECHTOLA (VR2) ,2.445,0,3,2,1,0,2,2,0.0,0.0
477,Begusarai,Cheriabariarpur ,2019-2020,BR04P2R-07,MRL01-Begusarai -Rosera To Aure East,4.6,0,3,2,1,0,2,2,0.0,0.0
